{
  "$schema": "https://json-schema.org/draft/2020-12/schema",
  "$id": "https://optees.org/schemas/simulator/v1/dataset_snapshot.v1.json",
  "title": "DatasetSnapshotManifest",
  "description": "Immutable manifest of a frozen dataset snapshot with source metadata, checksums, and series definitions.",
  "type": "object",
  "required": [
    "$type",
    "schema_version",
    "snapshot_id",
    "source_uri",
    "retrieval_time",
    "license",
    "checksum_sha256",
    "byte_size",
    "format",
    "series_catalog",
    "correction_handling"
  ],
  "additionalProperties": false,
  "properties": {
    "$type": {
      "type": "string",
      "const": "dataset_snapshot"
    },
    "schema_version": {
      "type": "string",
      "const": "1.0.0"
    },
    "snapshot_id": {
      "type": "string",
      "pattern": "^ds-snap_[a-zA-Z0-9_-]+$"
    },
    "source_uri": {
      "type": "string"
    },
    "retrieval_time": {
      "type": "string",
      "pattern": "^\\d{4}-\\d{2}-\\d{2}T\\d{2}:\\d{2}:\\d{2}(\\.\\d+)?Z$"
    },
    "license": {
      "type": "string",
      "minLength": 1
    },
    "checksum_sha256": {
      "type": "string",
      "pattern": "^sha256:[a-f0-9]{64}$"
    },
    "byte_size": {
      "type": "integer",
      "minimum": 1
    },
    "format": {
      "type": "string",
      "enum": ["JSONL", "PARQUET", "CSV"]
    },
    "series_catalog": {
      "type": "array",
      "minItems": 1,
      "items": {
        "type": "object",
        "required": [
          "series_id",
          "resource_id",
          "unit",
          "frequency",
          "earliest_event_time",
          "latest_event_time"
        ],
        "additionalProperties": false,
        "properties": {
          "series_id": {
            "type": "string",
            "minLength": 1
          },
          "resource_id": {
            "type": "string",
            "minLength": 1
          },
          "unit": {
            "type": "string",
            "minLength": 1
          },
          "frequency": {
            "type": "string",
            "minLength": 1
          },
          "earliest_event_time": {
            "type": "string",
            "pattern": "^\\d{4}-\\d{2}-\\d{2}T\\d{2}:\\d{2}:\\d{2}(\\.\\d+)?Z$"
          },
          "latest_event_time": {
            "type": "string",
            "pattern": "^\\d{4}-\\d{2}-\\d{2}T\\d{2}:\\d{2}:\\d{2}(\\.\\d+)?Z$"
          }
        }
      }
    },
    "correction_handling": {
      "type": "string",
      "minLength": 1
    }
  }
}
